Tweet,Suicide,Clean_Tweet
making some lunch,Not Suicide post,making lunch
you want his money,Not Suicide post,want money
that crap took me forever to put together im going to go sleep for days,Potential Suicide post ,crap took forever put together im going go sleep day
hey jer since when did you statwittering,Not Suicide post,hey jer since statwittering
trying out quotdelicious library 2quot with mixed results the bar code thought i wanted to add a spobra instead of a drill cool app tho,Not Suicide post,trying quotdelicious library 2quot mixed result bar code thought wanted add spobra instead drill cool app tho
oh that's good to hear but is it over already or you'll continue it after the holy week,Not Suicide post,oh 's good hear already 'll continue holy week
u've got a list for fellow you going to have to share that one amigo,Not Suicide post,u 've got list fellow going share one amigo
just because shane made a series on you doesnt mean people take you seriously y,Potential Suicide post ,shane made series doesnt mean people take seriously
time for some warsaw beer garden chilling,Not Suicide post,time warsaw beer garden chilling
i hate my life lmao i hope i die soon or sumn i'm too tired of everything,Potential Suicide post ,hate life lmao hope die soon sumn 'm tired everything
everything your lover does for you is for her survival everything your mother does for you is for your survival,Not Suicide post,everything lover survival everything mother survival
there is a stray cat on campus that looks like garfield the students are always feeding him so he is very fat like me,Not Suicide post,stray cat campus look like garfield student always feeding fat like
is on the go,Not Suicide post,go
i have an awful habit of avoiding writing papers by watching instagram live videos of the kids i used to nanny for,Potential Suicide post ,awful habit avoiding writing paper watching instagram live video kid used nanny
haha well i have more but i don't have to do anything but file the rest away or delete them,Not Suicide post,haha well n't anything file rest away delete
goooooood hwo're you,Not Suicide post,goooooood hwo 're
i want to say ill never be active again not quite sure i dont have any reason to be on here anymore anyways bye everyone t,Potential Suicide post ,want say ill never active quite sure dont reason anymore anyways bye everyone
focus on opportunities more than you focus on money,Not Suicide post,focus opportunity focus money
somebody please fucking kill me im so in love,Potential Suicide post ,somebody please fucking kill im love
im at the point of the semester where im so tired of everything i just want to roll over and die,Potential Suicide post ,im point semester im tired everything want roll die
gerrusengi want to die so much i dont want to be here anymore,Potential Suicide post ,gerrusengi want die much dont want anymore
and i hate the fact if it's true dojae will do surgery dojae has to endure the pain alone ' without segye a,Potential Suicide post ,hate fact 's true dojae surgery dojae endure pain alone ' without segye
when you're tired of living your life all you can do is close your eyes and go to sleep,Potential Suicide post ,'re tired living life close eye go sleep
i am going to kill myself right now i am sorry you are feeling so desperate,Potential Suicide post ,going kill right sorry feeling desperate
enjoy i just can't get into it this season but happy to know that you're getting your groove on,Not Suicide post,enjoy ca n't get season happy know 're getting groove
bloodstain on the carpet ready to gooo,Not Suicide post,bloodstain carpet ready gooo
really fuckin want this portion of my life to be over,Potential Suicide post ,really fuckin want portion life
i'm very very hungry don't anyone on my timeline dare to talk about food or i'll seriously eat you up,Not Suicide post,'m hungry n't anyone timeline dare talk food 'll seriously eat
mom always used to want everyone home before dark as though anything was out there at night that wasn't there during the day,Not Suicide post,mom always used want everyone home dark though anything night n't day
i think you'll do whatever you want,Not Suicide post,think 'll whatever want
that sounds so terrible that's how i was when my dad still lived w me but i hope it gets better for,Potential Suicide post ,sound terrible 's dad still lived w hope get better
no just one shortly before the soap awards judging starts,Not Suicide post,one shortly soap award judging start
just had a conversation with about how 'dependent' we seem to be of internet and mobile phones nowadays,Not Suicide post,conversation 'dependent ' seem internet mobile phone nowadays
oh yes i was reading that one,Not Suicide post,oh yes reading one
my life is so miserable and it's not getting better,Potential Suicide post ,life miserable 's getting better
you sau i stood up at 8 then off to offenbach home outside sunshine love you,Not Suicide post,sau stood 8 offenbach home outside sunshine love
she is not tired,Not Suicide post,tired
being a single mommy was never paof the plan but i wake up everyday and do my shit,Potential Suicide post ,single mommy never paof plan wake everyday shit
but what bezos de blasio and cuomo have down is walked into our little lego town kicked all of our lego towers a,Potential Suicide post ,bezos de blasio cuomo walked little lego town kicked lego tower
i want money,Not Suicide post,want money
how was it so i know what to expect,Not Suicide post,know expect
mmm mummy's culinary skills has been improving smells so good i'm loving home cooked food,Not Suicide post,mmm mummy 's culinary skill improving smell good 'm loving home cooked food
i need to put myself to rest i ve crashed my motorcycle today i don t know how but i m mostly fine it was the most beautiful moment of my life i know it s sick to think that but it felt good to see people approach me to help me after the crash the feeling of my body being dragged by my bike for several meters on the ground looking at the sky while this one song played in my earphonesi ve just felt emptiness for the past yearsi don t want this second chance i want to get on my broken bike bring it up to speed one last time and then just end it all i just don t want to drown anymore please,Potential Suicide post ,need put rest crashed motorcycle today know mostly fine beautiful moment life know sick think felt good see people approach help crash feeling body dragged bike several meter ground looking sky one song played earphonesi felt emptiness past yearsi want second chance want get broken bike bring speed one last time end want drown anymore please
brushin' mah teef secularly,Not Suicide post,brushin ' mah teef secularly
i'll be in london today wave if you see me,Not Suicide post,'ll london today wave see
i am looking for the berocca then all will be well,Not Suicide post,looking berocca well
thank you i thought it was pass it around have a great day luv ur stuff,Not Suicide post,thank thought pa around great day luv ur stuff
i want to die i dont deserve a piece of anything i dont belong anywhere im sick and tired of everything the sa,Potential Suicide post ,want die dont deserve piece anything dont belong anywhere im sick tired everything sa
i fucking hate my whole family all they do is making me feel fat and i'm so done with feeling bad about my body and,Potential Suicide post ,fucking hate whole family making feel fat 'm done feeling bad body
i luv your blog too fashion is lt3,Not Suicide post,luv blog fashion lt3
sorry for your loss this post gave me goosebumps because although i havent thought of suicide your d,Potential Suicide post ,sorry loss post gave goosebump although havent thought suicide
ha ha i started something with the rocquestar thing didn't i,Not Suicide post,ha ha started something rocquestar thing n't
photoboth is black and white and wayyyyy old we call him herbelol i love him he's like a living legend gotta love berlin lt3,Not Suicide post,photoboth black white wayyyyy old call herbelol love 's like living legend got ta love berlin lt3
the one we were looking out for,Not Suicide post,one looking
he want to kill her,Not Suicide post,want kill
you understand what the fuck im doing wrong with my life,Potential Suicide post ,understand fuck im wrong life
awwwwww i really wish i could be there to give ya some serious tlc rachel hunsending ya huge hugz and kisses,Not Suicide post,awwwwww really wish could give ya serious tlc rachel hunsending ya huge hugz kiss
looking for help on testing prawn pdfs with cucumber all i can find is prawn and cucumber salad recipes,Not Suicide post,looking help testing prawn pdfs cucumber find prawn cucumber salad recipe
he should tell them that his sister fixed it,Not Suicide post,tell sister fixed
something weird in that i couldn't stop thinking about him couldn't sleep then out of some old papers a card i di,Potential Suicide post ,something weird could n't stop thinking could n't sleep old paper card di
congratulations john i'm a creepy actor not a sweet actor,Not Suicide post,congratulation john 'm creepy actor sweet actor
he he thanks,Not Suicide post,thanks
in the photoshop,Not Suicide post,photoshop
normal workday for me i do still have plansaspirations to submit some info for the miz mag honest i do,Not Suicide post,normal workday still plansaspirations submit info miz mag honest
easy way is to go to mbk and get it hacked got a cn rom on his th phone,Not Suicide post,easy way go mbk get hacked got cn rom th phone
and i just dont want to fucking be here anymore please someone just fucking end me because i know itll be worse for everyone if i do it myself and fuck do i want to but please please someone just kill me please,Potential Suicide post ,dont want fucking anymore please someone fucking end know itll worse everyone fuck want please please someone kill please
i'm tired,Not Suicide post,'m tired
my cullen family jewellery set arrived this morning so happy,Not Suicide post,cullen family jewellery set arrived morning happy
getting ready to take kids to the farm,Not Suicide post,getting ready take kid farm
these boys might find it shocking that some internet stranger like myself would say fuck these guys,Potential Suicide post ,boy might find shocking internet stranger like would say fuck guy
i ate candy cigarettes but i didn't eat the wax once i drank the coke i did however eat the candy lips,Not Suicide post,ate candy cigarette n't eat wax drank coke however eat candy lip
i damn near hate smoking by myself but sometimes i like it cause i cant finish blunts and i be having some for later,Potential Suicide post ,damn near hate smoking sometimes like cause cant finish blunts later
is going to get some cereallllllll will be living off lucky charms next week woopwoop,Not Suicide post,going get cereallllllll living lucky charm next week woopwoop
quottagged as punk punk rock pop punk new york more people should listen to this band quot,Not Suicide post,quottagged punk punk rock pop punk new york people listen band quot
it's a great time in life we can help you design an amazing wedding,Not Suicide post,'s great time life help design amazing wedding
wow wow good to hear,Not Suicide post,wow wow good hear
feeling overwhelmed and wanting to die i tried to kill myself today all i wanted was my boyfriend to help me somehow since he sees me on this depression spiral but all he says is it will get better i know it will but currently i feel trapped in my own home i have no friends and i constantly feel weak or unmotivated i have no desire to have sex with my partner and tend to find the worst in him lately i love him but some things he does amplifies my depression i dont want to die but when i get hulonely or overwhelmed the one thought i cant shake is killing myself,Potential Suicide post ,feeling overwhelmed wanting die tried kill today wanted boyfriend help somehow since see depression spiral say get better know currently feel trapped home friend constantly feel weak unmotivated desire sex partner tend find worst lately love thing amplifies depression dont want die get hulonely overwhelmed one thought cant shake killing
asking everyone to send out happy 'headfirst' vibes to,Not Suicide post,asking everyone send happy 'headfirst ' vibe
and waiting for sunrise in spring with an amazing colors,Not Suicide post,waiting sunrise spring amazing color
good so far thanks hope yours will treat you well too,Not Suicide post,good far thanks hope treat well
ok then might not be for a while though,Not Suicide post,ok might though
its only the 12th and i have completed 75 of my selling goal im happy,Not Suicide post,12th completed 75 selling goal im happy
but stilli highkey want him to be dead he f killed peach and beck ughcandice is back so imma just,Potential Suicide post ,stilli highkey want dead f killed peach beck ughcandice back imma
take care guys,Not Suicide post,take care guy
my whole family is so damn beautiful and im the staof the ugly generation of it and i just hate myself so much i cant even express it,Potential Suicide post ,whole family damn beautiful im staof ugly generation hate much cant even express
my coworkers are my guinea pigs lucky for them i'm testing recipes from my ultimate cookie cook book,Not Suicide post,coworkers guinea pig lucky 'm testing recipe ultimate cookie cook book
damn i hate myself,Potential Suicide post ,damn hate
no i want him to get indicted amp watch the kids go to jail i dont want him to die because the trump,Potential Suicide post ,want get indicted amp watch kid go jail dont want die trump
ok legit question can i fucking kill myself i'm 100 done with life,Potential Suicide post ,ok legit question fucking kill 'm 100 done life
how's the ski jumping going have you beat the missus yet,Not Suicide post,'s ski jumping going beat missus yet
i hope i fucken change cause damn do i hate myself,Potential Suicide post ,hope fucken change cause damn hate
really good and helpful about the various crisis in the dc universe i have read them all,Not Suicide post,really good helpful various crisis dc universe read
nothing to live for why because you have been nasty,Potential Suicide post ,nothing live nasty
had a lovely night with the best boyfriend and two very good friends,Not Suicide post,lovely night best boyfriend two good friend
my girlfriend left me i hate college i have no direction in life i just want to go to sleep and never wake up ive been thinking about suicide a lot recently and different methods the only reason i havent done it so far is because i am too much of a pussy i have access to enough drugs to overdose on i live near plenty of tall buildings i am seeing a therapist and psychiatrist all the pills they ve given me have only exacerbated my symptoms i dont care about leaving everything behind because i dont want to huthe people around me but why should i go on living my shit life just so others arent inconvenienced one of these days i ll be drunk enough to finally pull the trigger figuratively literally,Potential Suicide post ,girlfriend left hate college direction life want go sleep never wake ive thinking suicide lot recently different method reason havent done far much pussy access enough drug overdose live near plenty tall building seeing therapist psychiatrist pill given exacerbated symptom dont care leaving everything behind dont want huthe people around go living shit life others arent inconvenienced one day drunk enough finally pull trigger figuratively literally
you dont have to bring anything it's yr place,Not Suicide post,dont bring anything 's yr place
rosie does he think im going to be single forever,Potential Suicide post ,rosie think im going single forever
chickfila bonus,Not Suicide post,chickfila bonus
yeah 16kg is around 40lbs glad you liked the interview i did with steve cotter quigong is sucha valuable paof any training,Not Suicide post,yeah 16kg around 40lbs glad liked interview steve cotter quigong sucha valuable paof training
what do you want to know about modx cms maybe i can help you,Not Suicide post,want know modx cm maybe help
i'm home from school yay wasn't that bad actually and i had a nice dinner with graceeeeee,Not Suicide post,'m home school yay n't bad actually nice dinner graceeeeee
im hoping my stress level will go down when my aunt is gone i cant relax am exhausted and can't focus on a dam,Potential Suicide post ,im hoping stress level go aunt gone cant relax exhausted ca n't focus dam
a friend i knew online from last night finally added me up on his messenger,Not Suicide post,friend knew online last night finally added messenger
i jst sneezed twice me thinks there's at least one ghost in my house now,Not Suicide post,jst sneezed twice think 's least one ghost house
thanks wani,Not Suicide post,thanks wani
haha get all your stress out x,Not Suicide post,haha get stress x
just added a little more grist to the mill,Not Suicide post,added little grist mill
you want every vote counted no matter if the voter is dead move to a different precinct ou,Potential Suicide post ,want every vote counted matter voter dead move different precinct ou
our barefoot range is a great alternative when you need to wear shoes they allow you foot move as though it were barefoot,Not Suicide post,barefoot range great alternative need wear shoe allow foot move though barefoot
there are no perks of being this ugly i deserve an award or something at least if im going to die alone,Potential Suicide post ,perk ugly deserve award something least im going die alone
random commenter asked why i had such an extreme social warrior agenda in magnus chase what he calls extreme social jus,Potential Suicide post ,random commenter asked extreme social warrior agenda magnus chase call extreme social jus
it's tuesdayat workstill riding the high from the workout last night it should be a good day,Not Suicide post,'s tuesdayat workstill riding high workout last night good day
so sad that i can't protect these cats and i don't know whats ever bothering them i don't know why this stuff has,Potential Suicide post ,sad ca n't protect cat n't know whats ever bothering n't know stuff
never been to war but i get terrible nightmares that wake me up fighting for my life,Potential Suicide post ,never war get terrible nightmare wake fighting life
cool,Not Suicide post,cool
ok that dinner rocked,Not Suicide post,ok dinner rocked
stuck every time i try and kill myself i cant go through with it but i cant keep living feeling this way why cant i just let myself die,Potential Suicide post ,stuck every time try kill cant go cant keep living feeling way cant let die
damn i hate when i type so fast and the autocorrect changes go unnoticed smh at myself,Potential Suicide post ,damn hate type fast autocorrect change go unnoticed smh
shes doing her best,Not Suicide post,shes best
live your best life,Not Suicide post,live best life
all i want is the truth,Not Suicide post,want truth
we are not fussy about age here as long as females are between 1825 i changed the rules lol,Not Suicide post,fussy age long female 1825 changed rule lol
im just going to go ahead and kill myself already done for the fucking day,Potential Suicide post ,im going go ahead kill already done fucking day
i cannot wait for my mum to fucking die all i wait is for her to die then i am going to lie under the train that very day and foolow suiti cannot wait i would kill her to be able to kill myself sooner but we are two in a very intimate relationship in shoi can not kill her guns are forbiden in my country i have got only a knife or a brick to do it and so i cant do it it s very bloody and slow method cannot do anything my tonsils stink i hate human stench in all forms except dashas shits i hate my body hate arteries these nose and lips and saliva and eyes and all i hate human body except dashas one i want to fuck and to be with my dasha,Potential Suicide post ,wait mum fucking die wait die going lie train day foolow suiti wait would kill able kill sooner two intimate relationship shoi kill gun forbiden country got knife brick cant bloody slow method anything tonsil stink hate human stench form except dashas shit hate body hate artery nose lip saliva eye hate human body except dashas one want fuck dasha
tania i think you should get athene and the rest of the crew on twitter,Not Suicide post,tania think get athene rest crew twitter
n i got yr pic posing in the server room,Not Suicide post,n got yr pic posing server room
bye bye going to sleep finally xdddd d p,Not Suicide post,bye bye going sleep finally xdddd p
working on a film have been busy have a nice day everyone,Not Suicide post,working film busy nice day everyone
i want to die where can i go to commit suicide give me an injection as i am unconconscious and end my nightmare life i want to die,Potential Suicide post ,want die go commit suicide give injection unconconscious end nightmare life want die
i want to play with it,Not Suicide post,want play
thanks to everyone who's sent me work this year you'll pleased to know i've just planted 85 trees in india with some of the profits x,Not Suicide post,thanks everyone 's sent work year 'll pleased know 've planted 85 tree india profit x
this is my notice of me giving up on life n becoming an alcoholic bc i'm miserable n want to die farewell ill be drunk,Potential Suicide post ,notice giving life n becoming alcoholic bc 'm miserable n want die farewell ill drunk
new iphone is completely updated sun shining in derry tis a pretty day,Not Suicide post,new iphone completely updated sun shining derry ti pretty day
i want to be a doctor,Not Suicide post,want doctor
cash in the attic is ok i prefer homes under the hammer haha i do love being off school,Not Suicide post,cash attic ok prefer home hammer haha love school
ill ride for my dawgs any day but at the end of the day i already know where the streets can take you amp i what hap,Potential Suicide post ,ill ride dawgs day end day already know street take amp hap
i want her,Not Suicide post,want
well compared to other areas west of us i'll take our 50 degrees and run with it,Not Suicide post,well compared area west u 'll take 50 degree run
aw i am so jealous please take me with you,Not Suicide post,aw jealous please take
blaine mni dont want to be here anymore,Potential Suicide post ,blaine mni dont want anymore
scared of death tired of living,Potential Suicide post ,scared death tired living
take it all back was so fun,Not Suicide post,take back fun
ive had enough of life and the pain it causes,Potential Suicide post ,ive enough life pain cause
oh my god the cringe i cant,Potential Suicide post ,oh god cringe cant
i love your shh tattoo did it hui think i'm going to get it,Not Suicide post,love shh tattoo hui think 'm going get
i literally cant explain everything so much has happened i dont want to be here anymore wtf is even the point i literally,Potential Suicide post ,literally cant explain everything much happened dont want anymore wtf even point literally
i want him,Not Suicide post,want
had a juice box this morning you never know the joy a juice box can bring until you have one later on in life,Not Suicide post,juice box morning never know joy juice box bring one later life
she didn't want him to go out with other women,Not Suicide post,n't want go woman
you're welcome it was a great way to be introduced to your music,Not Suicide post,'re welcome great way introduced music
awesome can't wait to see it,Not Suicide post,awesome ca n't wait see
my heais so crushed,Potential Suicide post ,heais crushed
ooo apple store is down so close credit card ready,Not Suicide post,ooo apple store close credit card ready
youve changed for the fucking worse i cant believe that you could really go back on all ur hard work like that,Potential Suicide post ,youve changed fucking worse cant believe could really go back ur hard work like
not just because the house has never had a black woman in leadership but because,Not Suicide post,house never black woman leadership
hey golden is here with me and just wanted to say hi and have a great morning,Not Suicide post,hey golden wanted say hi great morning
goooooood morning twitterworld,Not Suicide post,goooooood morning twitterworld
a revolution in household detergent introducing get one now while stocks last,Not Suicide post,revolution household detergent introducing get one stock last
everything that youve ever dreamed of,Potential Suicide post ,everything youve ever dreamed
congrats ill def go and suppothe tc media takeover,Not Suicide post,congrats ill def go suppothe tc medium takeover
going to bed goodnightttttt,Not Suicide post,going bed goodnightttttt
going to school and enjoying my last day as a 16 year old but too,Not Suicide post,going school enjoying last day 16 year old
hmmmnot goodcarrot juice and marmalade on toast may help,Not Suicide post,hmmmnot goodcarrot juice marmalade toast may help
im tired and sick of everything i want to die,Potential Suicide post ,im tired sick everything want die
no one has had more of an impact on my career and everything we do at marvel studios than stan lee stan leaves an extr,Not Suicide post,one impact career everything marvel studio stan lee stan leaf extr
9 months ago my grandmother passed away 8 months ago i got my heacompletely broken 7 months ago i almost attem,Potential Suicide post ,9 month ago grandmother passed away 8 month ago got heacompletely broken 7 month ago almost attem
really tired of everything it's all just so lame and gay nothing serious us ever going to happen an,Potential Suicide post ,really tired everything 's lame gay nothing serious u ever going happen
trying to figure out how this works,Not Suicide post,trying figure work
my life is miserable,Potential Suicide post ,life miserable
positive mental attitude today can't be as bad as yesterday,Not Suicide post,positive mental attitude today ca n't bad yesterday
good morning all,Not Suicide post,good morning
