Tweet,Suicide,Clean_Tweet
patient i hate myself and i want to die,Potential Suicide post ,patient hate want die
the worst pais i tire easily and i love napping fortunately i dont get tired until after work,Potential Suicide post ,worst pais tire easily love napping fortunately dont get tired work
when chelsea brings me chocolate and diet coke i'm happy again,Not Suicide post,chelsea brings chocolate diet coke 'm happy
i think she was merely directing the comment at you because she thought you might want to know,Not Suicide post,think merely directing comment thought might want know
i do not want all this,Not Suicide post,want
sometimes youll never know how bad you fucked up until one day you wake up with nothing,Potential Suicide post ,sometimes youll never know bad fucked one day wake nothing
liberals say conservatives are evil nothings further from the truth we believe in live amp let live libs think that big,Potential Suicide post ,liberal say conservative evil nothing truth believe live amp let live libs think big
utahwant to take that perfect selfie heres what you should be looking for in your phone camera,Potential Suicide post ,utahwant take perfect selfie here looking phone camera
another year has passed and i am still alone sad and suffering will i ever live with dignity or will,Potential Suicide post ,another year passed still alone sad suffering ever live dignity
i just want to remind yall that without iris barry allen would be dead right now but shes useless right,Potential Suicide post ,want remind yall without iris barry allen would dead right shes useless right
i feel better today got some sleep and its not raining so can take the beasts out,Not Suicide post,feel better today got sleep raining take beast
during revamp and shortly after they're out of now amp in real trouble but i'm going to be good amp not bag them publicy,Not Suicide post,revamp shortly 're amp real trouble 'm going good amp bag publicy
i want to be a businessman,Not Suicide post,want businessman
after effects has frozen and i did not i repeat i did not save my edit i want to actually fucking die it took,Potential Suicide post ,effect frozen repeat save edit want actually fucking die took
oh god sweet nicotine and tar i crave you both so bad today what is wrong with me lol hahaha xx,Not Suicide post,oh god sweet nicotine tar crave bad today wrong lol hahaha xx
welcome to the jungle,Not Suicide post,welcome jungle
chicago illife is hard i never thought id come onto social media to venttalk about my feelings but man my life sucks i dont want attention but i know this tweet makes it look like i do im done streaming youtube and just playing games all together just dont want to be here anymore,Potential Suicide post ,chicago illife hard never thought id come onto social medium venttalk feeling man life suck dont want attention know tweet make look like im done streaming youtube playing game together dont want anymore
i am a 20 year old transgirl who has been on hormones for about 4 months recently i suffered from a depressive episode due to gender dysphoria until about a couple weeks ago i just got a job and i was presenting myself as female and using a female name the only problem is that i still look somewhat masculine so i get stared at constantly and dismissed i cannot connect with any of my coworkers because i look and act strange to them i know i am supposed to wait on these hormones but i am really scared what if they dont work what if i ll get beaten up what if i lose my job due to just being me i want to be happy but its so hard its gotten to the point where all i do is just think about death and hope maybe i will get a do over i just cant take any of this anymore,Potential Suicide post ,20 year old transgirl hormone 4 month recently suffered depressive episode due gender dysphoria couple week ago got job presenting female using female name problem still look somewhat masculine get stared constantly dismissed connect coworkers look act strange know supposed wait hormone really scared dont work get beaten lose job due want happy hard gotten point think death hope maybe get cant take anymore
morning everyone,Not Suicide post,morning everyone
today one year ago i lost a neighbour and friend to so here is a quote that got me through my worst times f,Potential Suicide post ,today one year ago lost neighbour friend quote got worst time f
9 tails or not if he wanted to kill him hed be dead itachi couldve killed him but he didnt want toid,Potential Suicide post ,9 tail wanted kill hed dead itachi couldve killed didnt want toid
congratulations to gorb for graduating middle school we all hope you strive for greatness like you do on cod4,Not Suicide post,congratulation gorb graduating middle school hope strive greatness like cod4
i just had to google quothow to insemicrosd into blackberry boldquot found it though,Not Suicide post,google quothow insemicrosd blackberry boldquot found though
awakehopin my big brother gots time 4 me 2day just a lil bit atleast yay but katelyn might come up to hang with me,Not Suicide post,awakehopin big brother gots time 4 2day lil bit atleast yay katelyn might come hang
happy birthday to the legendary neil young he turns 73 today,Not Suicide post,happy birthday legendary neil young turn 73 today
my name is arya stark i want you to know that the last thing youre ever going to see is a stark smi,Potential Suicide post ,name arya stark want know last thing youre ever going see stark smi
oh hell yeah but that list should be made very passionately oops i ment patiently,Not Suicide post,oh hell yeah list made passionately oops ment patiently
lol yeah they can be loud so depends where your dryer is but they do get rid of the static very sneaky bout the dog lolx,Not Suicide post,lol yeah loud depends dryer get rid static sneaky bout dog lolx
somebody just fucking kill me please,Potential Suicide post ,somebody fucking kill please
too shy for that plus he already stole my brain in my sleep,Not Suicide post,shy plus already stole brain sleep
nah you're not unfortunate i dont eat that stuff cause i want to live a few years longer you're one of the smaones,Not Suicide post,nah 're unfortunate dont eat stuff cause want live year longer 're one smaones
yess i do and im in boston for a college fair and not school hahaa,Not Suicide post,yes im boston college fair school hahaa
we don't have tix just going to attend festivities,Not Suicide post,n't tix going attend festivity
happy birthdaaaaayyy bebe godbless youuu,Not Suicide post,happy birthdaaaaayyy bebe godbless youuu
o yes i am for sure am sooo happy that he checked it out again what time onish jaaaaaah lolm,Not Suicide post,yes sure sooo happy checked time onish jaaaaaah lolm
downloaded the pollock app i quite like it drew a flower lolz,Not Suicide post,downloaded pollock app quite like drew flower lolz
i literally hate myself for reading this damn book,Potential Suicide post ,literally hate reading damn book
better be adding bouncers back then no way yall are dumb enough to add this big a game change then,Potential Suicide post ,better adding bouncer back way yall dumb enough add big game change
i swear to move forward or get ahead in life,Not Suicide post,swear move forward get ahead life
and a following four day week,Not Suicide post,following four day week
i dont want your guns seriously im not sure who does,Potential Suicide post ,dont want gun seriously im sure
awww you'll have to use twitter for company,Not Suicide post,awww 'll use twitter company
we're coming back on sunday or monday,Not Suicide post,'re coming back sunday monday
i just realized that in a month i can celebrate my birthday with watching the wolverine movie then wwe raw nice timing,Not Suicide post,realized month celebrate birthday watching wolverine movie wwe raw nice timing
in the process of making doll no 2 and it's looking heaps better and cuter,Not Suicide post,process making doll 2 's looking heap better cuter
manchester england i just dont want to be here anymore,Potential Suicide post ,manchester england dont want anymore
i cant wait to get this damn nose job so i can take new selfies 'cause i hate every single picture of myself includ,Potential Suicide post ,cant wait get damn nose job take new selfies 'cause hate every single picture includ
wwwyoutubecomtitomi15watch the videoscommentampsuscribe amp follow me cheers x,Not Suicide post,wwwyoutubecomtitomi15watch videoscommentampsuscribe amp follow cheer x
greetings,Not Suicide post,greeting
he is a son of one of my friends,Not Suicide post,son one friend
famp the weather i'm in paris let's go have a beautiful day,Not Suicide post,famp weather 'm paris let 's go beautiful day
im such a disgusting disappointment ive gotten visibly fatter my cheeks are puffy and my stomach has actually de,Potential Suicide post ,im disgusting disappointment ive gotten visibly fatter cheek puffy stomach actually de
im happy i aint the same person i was last year,Not Suicide post,im happy aint person last year
almost broke down at class just because the most negative thoughts are kicking in and i'm mf tired of living hahahahahahahah,Potential Suicide post ,almost broke class negative thought kicking 'm mf tired living hahahahahahahah
i keep repeating to myself kill yourself kill yourself do it already i am ready to listen to my inner thoughts i have attempted in the past but at the last moment either i live through it just in a hellblaze of pain becoming a even bigger failure or my body stops me my mind screams to do it but sometimes my body just stops me sometimes my body will give up on life and i ll lay there wanting to shed a tear yet i know no one will care so i lay quietly in the darkness for days on end i try to drown out the voices with all i have left music but recently i dont care to listen to all i have to do what has stuck with me for all my life i am ready to listen to the voices i m ready to listen to my inner shouts if only i had easier access to guns my life would be so much harder but i dont instead i have to go out in either a more painfull way i hope others continue to have the will to carry on but sadly i think i lost mine,Potential Suicide post ,keep repeating kill kill already ready listen inner thought attempted past last moment either live hellblaze pain becoming even bigger failure body stop mind scream sometimes body stop sometimes body give life lay wanting shed tear yet know one care lay quietly darkness day end try drown voice left music recently dont care listen stuck life ready listen voice ready listen inner shout easier access gun life would much harder dont instead go either painfull way hope others continue carry sadly think lost mine
ouch,Not Suicide post,ouch
going to go cut up some chickeeeen,Not Suicide post,going go cut chickeeeen
i didn't want to think about it,Not Suicide post,n't want think
cotulla tx lacoste tx i just dont want to be here anymore,Potential Suicide post ,cotulla tx lacoste tx dont want anymore
magic rejuvenationhmm i'm thinking triple oxygen mask and a blissage105 hang in there,Not Suicide post,magic rejuvenationhmm 'm thinking triple oxygen mask blissage105 hang
just fuckin kill me,Potential Suicide post ,fuckin kill
looks like you found all the beer,Not Suicide post,look like found beer
i just want to have a friend or a group of friends that dont leave me out,Potential Suicide post ,want friend group friend dont leave
lol today any woman who can handle 7 kids inspires me,Not Suicide post,lol today woman handle 7 kid inspires
,Potential Suicide post ,
i never had to do the most throw shade or hate i can be quiet and bitches still want me dead thats pure hate and i,Potential Suicide post ,never throw shade hate quiet bitch still want dead thats pure hate
im actually tired of this its like living in a home where the troubled deceitful child always wins its not,Potential Suicide post ,im actually tired like living home troubled deceitful child always win
good morning the sun is shining and i am going to the beach with a few bff's see later when i am all tan,Not Suicide post,good morning sun shining going beach bff 's see later tan
but god does not only want us to be happy he wants us to be good,Not Suicide post,god want u happy want u good
photo eatsleepdraw so weird i like it,Not Suicide post,photo eatsleepdraw weird like
yo i seriously need to stop being so damn clingy to peoplelike i'm so bloody annoying i hate myself,Potential Suicide post ,yo seriously need stop damn clingy peoplelike 'm bloody annoying hate
hi thanks for the follow did you finish fob trail,Not Suicide post,hi thanks follow finish fob trail
i dont want them to come for my account literally the only thing keeping me through the miserable existence that,Potential Suicide post ,dont want come account literally thing keeping miserable existence
i am such a loving and caring person,Not Suicide post,loving caring person
i'd like to be linked on your site,Not Suicide post,'d like linked site
wherever the day takes us on route to youlgreave at mo sun is waking up,Not Suicide post,wherever day take u route youlgreave mo sun waking
my sleep was disturbed i am looking to end a career today,Not Suicide post,sleep disturbed looking end career today
well you do spend enough time there that you may as well subsidize your habit,Not Suicide post,well spend enough time may well subsidize habit
tired of living day by day like everythings alright,Potential Suicide post ,tired living day day like everythings alright
i just want to protect you,Not Suicide post,want protect
we had a visit from our lovely zone head today nice,Not Suicide post,visit lovely zone head today nice
we were tired from the conceso we ate noodles instead after wed eaten emily saw photos that the restaurant has,Potential Suicide post ,tired conceso ate noodle instead wed eaten emily saw photo restaurant
i just found a suicide note i'm fine i wrote in april seems like my dates were wrong this year nbc commentators keep,Potential Suicide post ,found suicide note 'm fine wrote april seems like date wrong year nbc commentator keep
go you,Not Suicide post,go
fast amp furious new model original parts a really good film,Not Suicide post,fast amp furious new model original part really good film
ecstatic that walmanow carries sambazon,Not Suicide post,ecstatic walmanow carry sambazon
i was assigned to sit next to the most awesome student in my class y hahaha,Not Suicide post,assigned sit next awesome student class hahaha
congratulations seye for being the latest of the week keep on creating keep on writing and,Not Suicide post,congratulation seye latest week keep creating keep writing
consists of going from failure to failure without loss of enthusiasm winston churchill,Not Suicide post,consists going failure failure without loss enthusiasm winston churchill
no doubt the obama fostered hate division chaos and anarchy they are th,Potential Suicide post ,doubt obama fostered hate division chaos anarchy th
i dont want to be here anymore my parents pressure me too much about getting a job like i am soliciting and such and yet they complain i dont feel comfortable living in my own house anymore all i want is just leave here for good and go to another country,Potential Suicide post ,dont want anymore parent pressure much getting job like soliciting yet complain dont feel comfortable living house anymore want leave good go another country
just fucking kill me already i dont want to be here anymore,Potential Suicide post ,fucking kill already dont want anymore
said he has a job but has time for this shit cant wait to see him next time i go on a maccas run,Potential Suicide post ,said job time shit cant wait see next time go maccas run
thinking of a hamsty bank account that's a good idea to save,Not Suicide post,thinking hamsty bank account 's good idea save
i really like the photo nice interview too,Not Suicide post,really like photo nice interview
i ll be dead just you wait and see my last words before my death for whoever is interestedi am sorry but youre better off without me youll learn to live without me it wont be difficult now i shall die,Potential Suicide post ,dead wait see last word death whoever interestedi sorry youre better without youll learn live without wont difficult shall die
but i know you want to hear about my examinations,Not Suicide post,know want hear examination
feeling numb hate my job i hate waking up everyday i feel nothing feel like i am on autopilot i got dumped 3 months ago almost from a 4 year relationship nothing cheers me up anymore my parents are in another state so i just can t go see them whenever i want i don t know if i could actually end it myself but i do dream of other ways like a car hitting me and killing me instantly i sometimes think of just taking a bunch of pills and letting that be it,Potential Suicide post ,feeling numb hate job hate waking everyday feel nothing feel like autopilot got dumped 3 month ago almost 4 year relationship nothing cheer anymore parent another state go see whenever want know could actually end dream way like car hitting killing instantly sometimes think taking bunch pill letting
got a quotthingquot for doctor chics,Not Suicide post,got quotthingquot doctor chic
im not okay lol i literally cant explain everything so much has happened i dont want to be here anymore wtf is even the point i literally cant i want everything to be over i cant breathe right because of how much im crying i cant do this anymore,Potential Suicide post ,im okay lol literally cant explain everything much happened dont want anymore wtf even point literally cant want everything cant breathe right much im cry cant anymore
i mean my life is miserable so i guess light at the end of the tunnel,Potential Suicide post ,mean life miserable guess light end tunnel
thanks david,Not Suicide post,thanks david
he didn't want her to go out with other man,Not Suicide post,n't want go man
cut my wrist and black my eeeeeyes,Potential Suicide post ,cut wrist black eeeeeyes
happieee birthday to our anni,Not Suicide post,happieee birthday anni
hate the fact that im damn near forced to figure everything out by myself but it must be done,Potential Suicide post ,hate fact im damn near forced figure everything must done
mmm oj scrambled eggs w cheese and toast gilmoregirls too ahhh this day is amazing now if i could only get the dryer to work,Not Suicide post,mmm oj scrambled egg w cheese toast gilmoregirls ahhh day amazing could get dryer work
,Not Suicide post,
i'm all for the fair tax or bush's deficit back something,Not Suicide post,'m fair tax bush 's deficit back something
with mainstream media's reporting amp the increasing occurrence of the fail whale you know eventually your friends will catch on,Not Suicide post,mainstream medium 's reporting amp increasing occurrence fail whale know eventually friend catch
seeing eno on thursday brian eno amp j peter schwalm like pictures pt 2 ntnet,Not Suicide post,seeing eno thursday brian eno amp j peter schwalm like picture pt 2 ntnet
while im fuckin at it buy a shiplease,Not Suicide post,im fuckin buy shiplease
mega monster munch,Not Suicide post,mega monster munch
i can just imagine how much of that howard would want to know,Not Suicide post,imagine much howard would want know
god damn vending machines are so depressing standing at them waiting for your sad little snack like some pavlovian bitch happy tuesday,Not Suicide post,god damn vending machine depressing standing waiting sad little snack like pavlovian bitch happy tuesday
i don't want to be here anymore,Potential Suicide post ,n't want anymore
noticed something interesting about this emoticon vs d totally different emotions only difference is the placement of the eyes,Not Suicide post,noticed something interesting emoticon v totally different emotion difference placement eye
may you live every day of your life jonathan swift,Not Suicide post,may live every day life jonathan swift
ok hold on how can these numbers not be correct anymore if the video is two weeks old strength of schedule and record dont change too much in two weeks and if yall dont care about top 4 why are you here won your division overranked to begin with what else you want,Potential Suicide post ,ok hold number correct anymore video two week old strength schedule record dont change much two week yall dont care top 4 division overranked begin else want
remembering the legendary former sh on his auspicious birthday,Not Suicide post,remembering legendary former sh auspicious birthday
i'm tired of everything pls so i want to die,Potential Suicide post ,'m tired everything pls want die
the road's not the widest and smoothest but there's some great clear views on the way up if you turn your head to the right,Not Suicide post,road 's widest smoothest 's great clear view way turn head right
now scribes can't wear their shoes to any press conference thanks to jarnail singh,Not Suicide post,scribe ca n't wear shoe press conference thanks jarnail singh
just chillin p i mean holidays nothing to do silence only me haha finally my relaxing time with a book typical for me lt3,Not Suicide post,chillin p mean holiday nothing silence haha finally relaxing time book typical lt3
watching this morning and deciding what to do with myself today think i'll keep searching for that elusive job,Not Suicide post,watching morning deciding today think 'll keep searching elusive job
2 wins in 2 weeks congratulations machine,Not Suicide post,2 win 2 week congratulation machine
i am loving you and line at the moment and my bank balance is liking it too great style made affordable,Not Suicide post,loving line moment bank balance liking great style made affordable
lucky for me i'm going to see that show in ny i hope that you will bring it to europe too in the fall i'll be there too,Not Suicide post,lucky 'm going see show ny hope bring europe fall 'll
im so tired today i want to lay in a bed full of boys and just have hugs sounds so good probably look even better,Not Suicide post,im tired today want lay bed full boy hug sound good probably look even better
i have such a nasty habit of comparing myself to other girls damn i hate myself,Potential Suicide post ,nasty habit comparing girl damn hate
yea im tired of living by myself,Potential Suicide post ,yea im tired living
schnes marketingwostimulus package,Not Suicide post,schnes marketingwostimulus package
totally jst started blasting atr at 10am dude my mom is going to kill me but who cares,Not Suicide post,totally jst started blasting atr 10am dude mom going kill care
graham tx i dont want to be here anymore,Potential Suicide post ,graham tx dont want anymore
tim fischer was on to talk about his love for his family and his,Not Suicide post,tim fischer talk love family
all i want rn is to get home and take a fucking shower and die,Potential Suicide post ,want rn get home take fucking shower die
no just didn't know if you thought putting stuff on your cat was phobe instead of phile glad kittys like the dome,Not Suicide post,n't know thought putting stuff cat phobe instead phile glad kitty like dome
i deadass hate my damn psn name i wish i named myself powerpuff234 there is at least one person in every 23 games th,Potential Suicide post ,deadass hate damn psn name wish named powerpuff234 least one person every 23 game th
hello new follwers,Not Suicide post,hello new follwers
oops again its t w i t t e r,Not Suicide post,oops w e r
man i want sancho to succeed here so badly hes a superstar just needs to believe it again,Not Suicide post,man want sancho succeed badly he superstar need believe
thats just the brilliance of tim coming out,Not Suicide post,thats brilliance tim coming
that is pretty awesome it makes me want a smacar now and a cup of tea,Not Suicide post,pretty awesome make want smacar cup tea
the indian roller a bird considered auspicious in india,Not Suicide post,indian roller bird considered auspicious india
it's the same here in new zealand too looking forward to them starting again already have a great night,Not Suicide post,'s new zealand looking forward starting already great night
you make me fucking cry every night and you dont even know it,Potential Suicide post ,make fucking cry every night dont even know
late night gaming with the guys fun times yesterday was a giddy day too lt3,Not Suicide post,late night gaming guy fun time yesterday giddy day lt3
tonight's the last time i'll spothis millajovovichesque hair will finally have a straight do tomorrow,Not Suicide post,tonight 's last time 'll spothis millajovovichesque hair finally straight tomorrow
is the top trend i am surprised but i couldn't have loved it more,Not Suicide post,top trend surprised could n't loved
our plans are coming together nicely i am very happy indeed today,Not Suicide post,plan coming together nicely happy indeed today
is laughing i cant believe flea attacks dougie xx,Not Suicide post,laughing cant believe flea attack dougie xx
some people tweets a lotthats cooli guess,Not Suicide post,people tweet lotthats cooli guess
wow i am adding thay to my list of shit to listen to when i want to die,Potential Suicide post ,wow adding thay list shit listen want die
honestly i dont want to be here anymore,Potential Suicide post ,honestly dont want anymore
my unofficial diagnosis is bipolar schizoaffective disorder it was a nightmare with so much trial and error with all sorts of therapies my medication a cocktail of about 20 pills a day has gotten me to a point where i can function day to day i dont know how i feel right now all i know though is i want it to stop,Potential Suicide post ,unofficial diagnosis bipolar schizoaffective disorder nightmare much trial error sort therapy medication cocktail 20 pill day gotten point function day day dont know feel right know though want stop
