Tweet,Suicide,Clean_Tweet
you think i like the feeling of walking past a homeless person knowing i'm going to give them money i wish,Potential Suicide post ,think like feeling walking past homeless person knowing 'm going give money wish
i am so tired of everything i just want to die,Potential Suicide post ,tired everything want die
yes go keep on bringing me down i swear ill deactivate my social medias and never come back because yeah you guys,Potential Suicide post ,yes go keep bringing swear ill deactivate social medias never come back yeah guy
yeah i watched your blog tv today my wife was the one who told you i wanted you as a pet lmao have a good night,Not Suicide post,yeah watched blog tv today wife one told wanted pet lmao good night
vacancy starring kate beckinsale and luke wilson going to watch it fariah lynnnnnn rocks,Not Suicide post,vacancy starring kate beckinsale luke wilson going watch fariah lynnnnnn rock
damn i really only have 4 hours to staand finish this paper for tomorrow i hate myself,Potential Suicide post ,damn really 4 hour staand finish paper tomorrow hate
yeah i saw i'm tempted to get into it but think i'll wait till the dvd set is out i like to be able to gorge myself on it,Not Suicide post,yeah saw 'm tempted get think 'll wait till dvd set like able gorge
pretty much trying to follow the more interesting ones at the moment,Not Suicide post,pretty much trying follow interesting one moment
microblog you have a good point,Not Suicide post,microblog good point
she was not tired,Not Suicide post,tired
installing call of duty 4 what a big don't hell yeah,Not Suicide post,installing call duty 4 big n't hell yeah
i cant live in this world ok its too much its too bad and too evil and i cant handle it anymore theres so much more evil in the world than good almost everyone is just apathetic about all the suffering in the world or people actively contribute to it people harass hate and kill each other for no reason people get killed by natural disasters and most people dont give a shit at all they just think whatever better them than me and move on with their lives,Potential Suicide post ,cant live world ok much bad evil cant handle anymore there much evil world good almost everyone apathetic suffering world people actively contribute people harass hate kill reason people get killed natural disaster people dont give shit think whatever better move life
hah quotif i don't have much timequot good point,Not Suicide post,hah quotif n't much timequot good point
nowt wrong with abit of cheese monsieur winsor,Not Suicide post,nowt wrong abit cheese monsieur winsor
this is truly a horrifying article most of us don't have the underlying deep hereditary mental health disorder tha,Potential Suicide post ,truly horrifying article u n't underlying deep hereditary mental health disorder tha
is proud that wilmington de has decreased the number of homicides compared to this time last year by 62 absolutely commendable,Not Suicide post,proud wilmington de decreased number homicide compared time last year 62 absolutely commendable
staffordshire uk oh peter your rid of him now so life will only get better dont let him get to you anymore the tears will go and you can be free once and for all here is you want to chat always xxx,Potential Suicide post ,staffordshire uk oh peter rid life get better dont let get anymore tear go free want chat always xxx
messi is not tired,Not Suicide post,messi tired
im a waste of space and i deserve to die,Potential Suicide post ,im waste space deserve die
what a dominating performance let the celebrations begin best wishes for the games ahead,Not Suicide post,dominating performance let celebration begin best wish game ahead
damn i hate myself,Potential Suicide post ,damn hate
namjoon damn i hate myself,Potential Suicide post ,namjoon damn hate
i ve got exactly 23 days of life left and ive never felt so calm or at peace id rather not wait till then but its the first day i will be completely alone and have the time i need this,Potential Suicide post ,got exactly 23 day life left ive never felt calm peace id rather wait till first day completely alone time need
congratulations to our 5 lucky winners,Not Suicide post,congratulation 5 lucky winner
bitch i'm going to kill myself what the fuck,Potential Suicide post ,bitch 'm going kill fuck
lady im on the hill ready to fucking just die already,Potential Suicide post ,lady im hill ready fucking die already
i want to be married,Not Suicide post,want married
i hate when i have to rate my group members because ill always rate them higher than id rate myself knowing damn well,Potential Suicide post ,hate rate group member ill always rate higher id rate knowing damn well
final results from my cbs bracket challenge for the ncaa mens tourney 802911th surely the 'generation y' folks will send me a trophy,Not Suicide post,final result cbs bracket challenge ncaa men tourney 802911th surely 'generation ' folk send trophy
my ggrandfather fought in ww1 earning the military medal at la boisselle then in 3,Potential Suicide post ,ggrandfather fought ww1 earning military medal la boisselle 3
lol curry cuppa tea glass of merlot a free doggie i'm happy to negotiate,Not Suicide post,lol curry cuppa tea glass merlot free doggie 'm happy negotiate
dang man im so god damn insecure sigh i hate myself,Potential Suicide post ,dang man im god damn insecure sigh hate
i want a xbox but i only want it for state of decay and i dead ass dont have time to play it now really would be a pointless purchase,Potential Suicide post ,want xbox want state decay dead a dont time play really would pointless purchase
today's goal complete everything on my to do list or nap all day lol,Not Suicide post,today 's goal complete everything list nap day lol
my cousin recently retired 30 years in military committed suicide the day was elected,Potential Suicide post ,cousin recently retired 30 year military committed suicide day elected
the leader of the band is tiredamphis eyes are growing old,Potential Suicide post ,leader band tiredamphis eye growing old
hope you had a fun time mate,Not Suicide post,hope fun time mate
oh not alot uni working same as just about everyone handed in the first assignment in over a year on friday was crazy,Not Suicide post,oh alot uni working everyone handed first assignment year friday crazy
dunno what you just said but i like it,Not Suicide post,dunno said like
is getting ready to take munchlet to the vet then doing absolutely nothing but relaxing next two days off,Not Suicide post,getting ready take munchlet vet absolutely nothing relaxing next two day
i love it so exciting to see new growth everywhere insects making most of first pollen bustling in hedges birdsong,Not Suicide post,love exciting see new growth everywhere insect making first pollen bustling hedge birdsong
i hate myself so much i want to kill myself how are yall,Potential Suicide post ,hate much want kill yall
just got in a car accident and i wish it had been worse and that i had gotten fatally injured when i was driving sometimes i imagine just crashing into something and dying i have had some close calls recently with other drivers and i often think afterward that i wish they had ended up hitting me i dont know why i feel like this ive been taking sertraline the generic version of zoloft which has stopped me from feeling horrible on a normal day to day basis but whenever something out of the ordinary happens like this car accident or i mess something up its like i had never taken the medsi feel like i both want to and dont want to die these last couple of years have been horrible for me but i still have dreams and want to do things before i started taking the sertraline i was actively planning my death but now its like i feel half wanting to keep going and half wanting to die before my life moves forward too much this car accident is going to cost me and my family a lot of money and its all my fault maybe they would have gotten some compensation if i had died if i wasnt around anymore they would be sad but i also wouldnt be able to disappoint them and cost them more than they can afford anymorei ama terrible daughter,Potential Suicide post ,got car accident wish worse gotten fatally injured driving sometimes imagine crashing something dying close call recently driver often think afterward wish ended hitting dont know feel like ive taking sertraline generic version zoloft stopped feeling horrible normal day day basis whenever something ordinary happens like car accident mess something like never taken medsi feel like want dont want die last couple year horrible still dream want thing started taking sertraline actively planning death like feel half wanting keep going half wanting die life move forward much car accident going cost family lot money fault maybe would gotten compensation died wasnt around anymore would sad also wouldnt able disappoint cost afford anymorei ama terrible daughter
thanks bro baru dpt login wc td lps reset password balik,Not Suicide post,thanks bro baru dpt login wc td lp reset password balik
yea they just keep getting better,Not Suicide post,yea keep getting better
good morning jason hope you're enjoying tweeting my twitter friend,Not Suicide post,good morning jason hope 're enjoying tweeting twitter friend
does anyone know where i can buy piano sheet music for the script because i'm reluctant to order it online if i can buy it in dublin,Not Suicide post,anyone know buy piano sheet music script 'm reluctant order online buy dublin
of course i just don't trust any single source or filter of data,Not Suicide post,course n't trust single source filter data
awesome song by press play on tape geekyness at it's best,Not Suicide post,awesome song press play tape geekyness 's best
lol i thought this was a post about buying good cheap wines,Not Suicide post,lol thought post buying good cheap wine
night kelly x,Not Suicide post,night kelly x
i hate when im talking to myself and someones like huh cant a girl have a conversation with herself in peace around here god damn,Potential Suicide post ,hate im talking someone like huh cant girl conversation peace around god damn
its good people like you aren't scared to say the real tweets transparency is shown for real cheers,Not Suicide post,good people like n't scared say real tweet transparency shown real cheer
that guy is the total complete product of progressive reeducation in other words he',Potential Suicide post ,guy total complete product progressive reeducation word '
i woke up with a bag over my head after i intentionally overdosed on a conbo of 250 mg diclazepam half a handle of bou,Potential Suicide post ,woke bag head intentionally overdosed conbo 250 mg diclazepam half handle bou
insulting did you invent it now i know what to get you for your birthday,Not Suicide post,insulting invent know get birthday
and it make no logical sense in their twisted v,Potential Suicide post ,make logical sense twisted v
interesting night i love my sisters,Not Suicide post,interesting night love sister
unfortunately i cant leave well enough alone and in trying,Potential Suicide post ,unfortunately cant leave well enough alone trying
basil and hafiz are having a very nice gay moment in the studio,Not Suicide post,basil hafiz nice gay moment studio
i want to say ill never be active again not quite sure i dont have any reason to be on here anymore anyways bye everyone take care,Potential Suicide post ,want say ill never active quite sure dont reason anymore anyways bye everyone take care
pain its just like fire amp memories are the alcohol that increases its flare have you ever felt the crack of your broken,Potential Suicide post ,pain like fire amp memory alcohol increase flare ever felt crack broken
and a certain centurion's servant who was dear unto him was sick and ready to die luke 72,Potential Suicide post ,certain centurion 's servant dear unto sick ready die luke 72
woop i'm keen to head to sydneymelbourne even if yyy come here we should still roadtrip,Not Suicide post,woop 'm keen head sydneymelbourne even yyy come still roadtrip
bom dia twitters,Not Suicide post,bom dia twitter
tweetdeck icons annoyng your desktop change from deviana,Not Suicide post,tweetdeck icon annoyng desktop change deviana
castroville tx i just dont want to be here anymore,Potential Suicide post ,castroville tx dont want anymore
thank you kal you're great good luck on everything that you'll do,Not Suicide post,thank kal 're great good luck everything 'll
i almost attempted suicide again when someone blackmailed me and threatened to have me thrown in jail for something i didnt do he knew where i worked and my parents names,Potential Suicide post ,almost attempted suicide someone blackmailed threatened thrown jail something didnt knew worked parent name
hy colei come from germany and my biggest wish is to have contact with youi know that i never can see you but its ok,Not Suicide post,hy colei come germany biggest wish contact youi know never see ok
i love each time up post an update ur profile picture is an amazing site let me tell you,Not Suicide post,love time post update ur profile picture amazing site let tell
why is it that everyday i hate my life more and more i really feel im destined to be miserable forever,Potential Suicide post ,everyday hate life really feel im destined miserable forever
searching for a good dress any care to help me,Not Suicide post,searching good dress care help
i just finished feeding kayden his breakfast so now we are relaxing and watching shrek,Not Suicide post,finished feeding kayden breakfast relaxing watching shrek
when my bottle pop shake me,Not Suicide post,bottle pop shake
oh blimey it's not you is it don't worry i wouldn't say anything here that i wouldn't say to them personally,Not Suicide post,oh blimey 's n't worry would n't say anything would n't say personally
just waking up and can't decide what drink to have for breakfast amp some people are becoming twitter addicts its funny,Not Suicide post,waking ca n't decide drink breakfast amp people becoming twitter addict funny
and as we turn and look to the future very interesting times ahead,Not Suicide post,turn look future interesting time ahead
congratulations to for winning music group of 2018 at the,Not Suicide post,congratulation winning music group 2018
going back to os x after a forced 5 month hiatus with only my windows and linux boxes makes me a happy camper,Not Suicide post,going back o x forced 5 month hiatus window linux box make happy camper
12 hr debugging for a css problem on a colleague's computer before i remembered that i installed ie8 on my pc a couple of weeks ago,Not Suicide post,12 hr debugging c problem colleague 's computer remembered installed ie8 pc couple week ago
anyways arohas lets work hard to show our love and suppofor astro in this comeback as they provide us with another good,Not Suicide post,anyways arohas let work hard show love suppofor astro comeback provide u another good
tillsonburg ontario ok,Potential Suicide post ,tillsonburg ontario ok
i took a twitter break now i'm back,Not Suicide post,took twitter break 'm back
hah round is a shape indeed and there are round parts of me i'd like to plane down,Not Suicide post,hah round shape indeed round part 'd like plane
nishinoya small and ready to die eat my ass spirits,Potential Suicide post ,nishinoya small ready die eat a spirit
i think it may be time for some really dirty songs from nickelback lol,Not Suicide post,think may time really dirty song nickelback lol
it's just a toolbar with a set of functions not very special actually it's not that specifically useful for a translator,Not Suicide post,'s toolbar set function special actually 's specifically useful translator
fuck it i can't sleep going shopping today,Not Suicide post,fuck ca n't sleep going shopping today
i be asking god why do i keep loosing people in my life but i see why everyday you can't move ahead in life,Not Suicide post,asking god keep loosing people life see everyday ca n't move ahead life
hurrah someone is listening delay so long have now missed meeting back home to walk dog and reschedule,Not Suicide post,hurrah someone listening delay long missed meeting back home walk dog reschedule
i think he got our descriptions mixed up bugmum either that or you gotta tease him more treat em mean,Not Suicide post,think got description mixed bugmum either got ta tease treat em mean
had to follow after reading that tweet about quotwhy is it that every second quot,Not Suicide post,follow reading tweet quotwhy every second quot
looking forward to the new website,Not Suicide post,looking forward new website
wishing you all the happiness and love in the,Not Suicide post,wishing happiness love
feel like running away far away in a great place where no one can find me,Not Suicide post,feel like running away far away great place one find
i'm gunna have a lazy day today woo good timezzzzzzzz,Not Suicide post,'m gunna lazy day today woo good timezzzzzzzz
i want to kill myself but i am afraid to die i have been dealing with this pain for about 3 years i have seen many therapists and have tried medication nothing has worked i told my parents tonight that i wanted to commit suicide and it has caused nothing but chaos in my house i have been looking online for ways to die and have figured that drinking and taking medication is the way to go for me i have already been drinking but have been hesitant to take medication because i am scared to die i do not believe in god i do not know what comes after death i am scared of pain and afraid that it will huand i will not succeed,Potential Suicide post ,want kill afraid die dealing pain 3 year seen many therapist tried medication nothing worked told parent tonight wanted commit suicide caused nothing chaos house looking online way die figured drinking taking medication way go already drinking hesitant take medication scared die believe god know come death scared pain afraid huand succeed
i stay up all night tryna make myself feel alright i'm too uncomfortable to fall asleep ugh fuck this bitch of a ro,Potential Suicide post ,stay night tryna make feel alright 'm uncomfortable fall asleep ugh fuck bitch ro
my life is meaningless i just want to end my life so badly my life is completely empty and i dont want to have to create meaning in it creating meaning is pain how long will i hold back the urge to run my car head first into the next person coming the opposite way when will i stop feeling jealous of tragic characters like gomer pile for the swift end they were able to bring to their lives,Potential Suicide post ,life meaningless want end life badly life completely empty dont want create meaning creating meaning pain long hold back urge run car head first next person coming opposite way stop feeling jealous tragic character like gomer pile swift end able bring life
hi tita now i know why she is the most humble and most genuine even though it,Not Suicide post,hi tita know humble genuine even though
why is it that i can absolutely nail my job that i despise with all my heabut manage to royally fuck up every si,Potential Suicide post ,absolutely nail job despise heabut manage royally fuck every si
sat at home doing nothing looking foward to bakewell next week though,Not Suicide post,sat home nothing looking foward bakewell next week though
i have liked ryder for quite awhile amp it was good to see him perform on a televised fight i am loving it,Not Suicide post,liked ryder quite awhile amp good see perform televised fight loving
haha 2 am lol oh my god im freezing too haha,Not Suicide post,haha 2 lol oh god im freezing haha
i saw your photos hot,Not Suicide post,saw photo hot
cool now i have my own leaping theme music i am going to forgo thinking about the fact that it is the pepe le pew music and just leap,Not Suicide post,cool leaping theme music going forgo thinking fact pepe le pew music leap
about time that mc flipside mix came out its sooooooooooooo goooooooooood,Not Suicide post,time mc flipside mix came sooooooooooooo goooooooooood
with my financial situation getting worse so does my mental health suicide is my plan z and i feel like i am about to reach plan z i think i should have just committed suicide at 15 years old when i thought about it a lot now i grew up and i made my life worse,Potential Suicide post ,financial situation getting worse mental health suicide plan z feel like reach plan z think committed suicide 15 year old thought lot grew made life worse
every day becomes a disappointment for us americans that want our america back as it is to be l,Potential Suicide post ,every day becomes disappointment u american want america back l
i am supporting for this,Not Suicide post,supporting
i am just tired of everything i want to die,Potential Suicide post ,tired everything want die
how much anger must you be carrying to treat a stranger whos lifestrugglesbattles you know nothing about so poorly,Potential Suicide post ,much anger must carrying treat stranger who lifestrugglesbattles know nothing poorly
prays for his new job career praise god i got a new job,Not Suicide post,prays new job career praise god got new job
hooraaaaaaaaaay proud to have been an itty bitty droplet in this congratulations you,Not Suicide post,hooraaaaaaaaaay proud itty bitty droplet congratulation
release my body,Potential Suicide post ,release body
i swear some you motherfuckers want people to be horrible racist rapist homophobic pedophiles after they die and you gi,Potential Suicide post ,swear motherfucker want people horrible racist rapist homophobic pedophile die gi
me happy birthday loving the foxy avatar pic as well serious party plans for the big day,Not Suicide post,happy birthday loving foxy avatar pic well serious party plan big day
i did something on the 2 of october i overdosed i just felt so alone and horrible i was in hospital for two days now when i walk down the hallways of my school they always look at me weird and say i should take more pills and i hate it i have no one i have this voice in my head now and it wont go away and i cant be myself anymore thanks for reading,Potential Suicide post ,something 2 october overdosed felt alone horrible hospital two day walk hallway school always look weird say take pill hate one voice head wont go away cant anymore thanks reading
big law killed my husband' an open letter from a sidley partner's widow,Potential Suicide post ,big law killed husband ' open letter sidley partner 's widow
we can all have a fun ladies night anyone can join,Not Suicide post,fun lady night anyone join
guess who will die today thats me im too tired of everything rn and im too hurt,Potential Suicide post ,guess die today thats im tired everything rn im hurt
i just want to bring up mac didnt die from cocaine mixed with fentanyl he literally had a line shit aint been t,Potential Suicide post ,want bring mac didnt die cocaine mixed fentanyl literally line shit aint
watching tron oh my goodness genius stuff d the bike scene just flashed by,Not Suicide post,watching tron oh goodness genius stuff bike scene flashed
having sugar puffs for breakfast amp listening to mcfly what a great way to stamy day,Not Suicide post,sugar puff breakfast amp listening mcfly great way stamy day
having 100 slides again,Not Suicide post,100 slide
newfoundland canada i want to say ill never be active again not quite sure i dont have any reason to be on here anymore anyways bye everyone t,Potential Suicide post ,newfoundland canada want say ill never active quite sure dont reason anymore anyways bye everyone
we are open again today from 1000 am til 7 pm come in and see us,Not Suicide post,open today 1000 til 7 pm come see u
sorry i keep missing you kd you don't need to apoligise for nothing we all have bad days an what you are dealing,Potential Suicide post ,sorry keep missing kd n't need apoligise nothing bad day dealing
bless ya fella,Not Suicide post,bless ya fella
i never say my life is miserable my life is pretty good not going to lie but what it seems to be a privileged life may n,Potential Suicide post ,never say life miserable life pretty good going lie seems privileged life may n
good routes here was today's ride 2 laps,Not Suicide post,good route today 's ride 2 lap
this is painful and just the thought of losing another young person to suicide makes it extremely hard to see a fam,Potential Suicide post ,painful thought losing another young person suicide make extremely hard see fam
i loved you on chelsea lately,Not Suicide post,loved chelsea lately
moody woods is absolutely awesome,Not Suicide post,moody wood absolutely awesome
since we're talking abt him hey uhh remember when yanderedev said intellectually disabled people deserve to die p,Potential Suicide post ,since 're talking abt hey uhh remember yanderedev said intellectually disabled people deserve die p
oh that was great thanks i'll pass it around,Not Suicide post,oh great thanks 'll pa around
oh my god serious why not it was shit im getting thursday off tho wat do you want to do i got a reply yeow,Not Suicide post,oh god serious shit im getting thursday tho wat want got reply yeow
you're such a sweet daughterinlaw i hope it goes well today,Not Suicide post,'re sweet daughterinlaw hope go well today
ooh i've never been to the alameda flea market must check it out thank you,Not Suicide post,ooh 've never alameda flea market must check thank
cool stuff,Not Suicide post,cool stuff
i've truly never been happier with my life i'm rid of all the toxic people who brought me down and those,Potential Suicide post ,'ve truly never happier life 'm rid toxic people brought
thats a big one,Not Suicide post,thats big one
was no reason for you to get banned 2k not rightronnie stay banning folks that do nothing but try,Potential Suicide post ,reason get banned 2k rightronnie stay banning folk nothing try
